{
  "schema": "plinth.ask_answer/1",
  "thread_id": "6f0e2c1a-0000-4000-8000-000000000402",
  "kind": "refusal",
  "disclosure_line": "Ask Plinth is an AI. It answers from public records like HARERA and shows its sources.",
  "sentences": [
    {
      "text": "I can't tell you whether to buy. That's your call, and no developer pays us to steer it. Here's how to decide:",
      "cite": []
    }
  ],
  "sources": [],
  "cards": [],
  "actions": [],
  "refusal_code": "advice_buy_sell",
  "handoff": {
    "label": "Talk to a Plinth adviser · free · developers never pay us",
    "hours_line": "Mon–Sat 10 am–7 pm, usually within 4 working hours"
  },
  "as_of_line": "Records as of 14 Oct 2026"
}
